nom,organisation_nom,plateforme,repertoire_url,description,est_fork,date_creation,derniere_mise_a_jour,page_accueil,nombre_stars,nombre_forks,licence,nombre_issues_ouvertes,langage,topics
AD-permissions,ANSSI-FR,GitHub,https://github.com/ANSSI-FR/AD-permissions,Active Directory permissions (ACL/ACE) auditing tools,False,2012-07-04T09:18:18Z,2019-05-25T11:53:56Z,,120,17,Other,0,PHP,
xsvgen,ANSSI-FR,GitHub,https://github.com/ANSSI-FR/xsvgen,XML Schema Validator Generator,False,2013-05-21T12:36:23Z,2018-07-03T07:47:53Z,,10,1,Other,1,OCaml,
SysvolExplorer,ANSSI-FR,GitHub,https://github.com/ANSSI-FR/SysvolExplorer,Active Directory Group Policy analyzer,False,2014-04-10T13:11:12Z,2019-05-23T02:48:30Z,,51,14,,0,C++,
AD-control-paths,ANSSI-FR,GitHub,https://github.com/ANSSI-FR/AD-control-paths,Active Directory Control Paths auditing and graphing tools,False,2014-07-07T15:26:43Z,2019-05-25T11:53:59Z,https://www.sstic.org/2014/presentation/chemins_de_controle_active_directory/,349,68,Other,1,C,
picon,ANSSI-FR,GitHub,https://github.com/ANSSI-FR/picon,Picon,False,2015-05-27T07:56:02Z,2019-04-12T08:13:28Z,,30,4,GNU Lesser General Public License v2.1,0,C,
tabi,ANSSI-FR,GitHub,https://github.com/ANSSI-FR/tabi,BGP Hijack Detection,False,2016-02-04T15:27:01Z,2019-05-23T02:47:51Z,,75,26,Other,3,Python,"bgp,classification,detection,hijack"
mabo,ANSSI-FR,GitHub,https://github.com/ANSSI-FR/mabo,MRT Parser,False,2016-02-04T15:27:23Z,2019-04-05T11:02:39Z,,41,6,Other,1,OCaml,"bgp,json,mrt,ocaml,parser"
OVALI,ANSSI-FR,GitHub,https://github.com/ANSSI-FR/OVALI,"Generic graph exploration, manipulation and visualization tool (Outil de Visualisation et Analyse de Liens Inter-objets)",False,2016-03-01T15:59:21Z,2019-03-21T11:11:09Z,,25,15,"BSD 3-Clause ""New"" or ""Revised"" License",2,JavaScript,
polichombr,ANSSI-FR,GitHub,https://github.com/ANSSI-FR/polichombr,Collaborative malware analysis framework,False,2016-05-31T18:54:28Z,2019-05-23T18:20:35Z,,255,47,Other,20,Python,"ida,ida-plugin,idapro,malware-analysis,malware-research,reverse-engineering,security-tools"
nogaxeh,ANSSI-FR,GitHub,https://github.com/ANSSI-FR/nogaxeh,Tools for analyzing hexagon code,False,2016-06-22T15:11:30Z,2019-05-12T01:53:17Z,,31,6,GNU General Public License v3.0,1,C++,
bmc-tools,ANSSI-FR,GitHub,https://github.com/ANSSI-FR/bmc-tools,RDP Bitmap Cache parser,False,2016-06-27T11:32:35Z,2019-05-23T02:42:46Z,,87,12,Other,2,Python,
ADCP-libdev,ANSSI-FR,GitHub,https://github.com/ANSSI-FR/ADCP-libdev,AD-control-paths libraries submodule,False,2016-08-26T14:55:46Z,2019-05-24T12:52:39Z,,2,2,Other,0,C,
ADCP-DirectoryCrawler,ANSSI-FR,GitHub,https://github.com/ANSSI-FR/ADCP-DirectoryCrawler,AD-control-paths LDAP submodule,False,2016-08-26T14:58:20Z,2019-05-23T02:45:49Z,,8,3,Other,0,C,
SecuML,ANSSI-FR,GitHub,https://github.com/ANSSI-FR/SecuML,Machine Learning for Computer Security,False,2016-09-05T08:15:59Z,2019-05-23T13:05:13Z,https://anssi-fr.github.io/SecuML,146,35,GNU General Public License v2.0,0,Python,"active-learning,gui,interactive-machine-learning,intrusion-detection,machine-learning,malware-detection,rare-category-detection"
SmartPGP,ANSSI-FR,GitHub,https://github.com/ANSSI-FR/SmartPGP,SmartPGP is a JavaCard implementation of the OpenPGP card specifications,False,2016-10-12T15:16:32Z,2019-05-20T21:23:11Z,,84,20,GNU General Public License v2.0,3,Java,
bootcode_parser,ANSSI-FR,GitHub,https://github.com/ANSSI-FR/bootcode_parser,"A boot record parser that identifies known good signatures for MBR, VBR and IPL.",False,2017-01-17T16:56:59Z,2019-03-26T10:47:18Z,,74,19,GNU General Public License v3.0,3,Python,"bios,boot-record,bootkit,forensics,ipl,mbr,vbr,windows"
libecc,ANSSI-FR,GitHub,https://github.com/ANSSI-FR/libecc,Library for elliptic curves cryptography,False,2017-05-15T09:20:25Z,2019-05-17T07:51:52Z,,87,19,Other,1,C,
Binacle,ANSSI-FR,GitHub,https://github.com/ANSSI-FR/Binacle,Full-bin indexation of binary files,False,2017-05-15T15:13:27Z,2019-05-14T12:16:55Z,,82,9,Other,0,Rust,
packetweaver,ANSSI-FR,GitHub,https://github.com/ANSSI-FR/packetweaver,A Python framework for script filing and task sequencing,False,2017-05-19T12:53:33Z,2019-05-01T15:13:15Z,,24,7,,0,Python,
ProTIP,ANSSI-FR,GitHub,https://github.com/ANSSI-FR/ProTIP,ProTIP permet de caractériser la connectivité réelle entre composants d'une architecture PCI Express,False,2017-06-01T16:20:30Z,2019-04-12T09:00:14Z,,7,0,MIT License,0,Prolog,
WSUS_Audit,ANSSI-FR,GitHub,https://github.com/ANSSI-FR/WSUS_Audit,Auditing scripts for WSUS infrastructures,False,2017-06-07T07:46:12Z,2018-12-28T05:38:48Z,,5,0,,1,,
route_leaks,ANSSI-FR,GitHub,https://github.com/ANSSI-FR/route_leaks,BGP Route Leaks Detection,False,2017-06-20T13:12:04Z,2019-04-12T01:09:55Z,,49,14,Other,0,Python,"bgp,detection,leaks,route-leaks-detection"
pciemem,ANSSI-FR,GitHub,https://github.com/ANSSI-FR/pciemem,"Linux kernel module for driving an USB3380 board, exposing a /dev/pciemem device node on the analysis machine representing the physical memory of the machine under test",False,2017-08-01T15:44:09Z,2018-12-28T13:35:08Z,,5,1,,0,C,
caml-crush,ANSSI-FR,GitHub,https://github.com/ANSSI-FR/caml-crush,Caml Crush: an OCaml PKCS#11 filtering proxy,False,2017-12-08T13:00:31Z,2018-12-28T05:38:32Z,,2,0,,0,,
opkcs11-tool,ANSSI-FR,GitHub,https://github.com/ANSSI-FR/opkcs11-tool,opkcs11-tool: managing and operating PKCS #11 security tokens in OCaml,False,2017-12-08T13:57:22Z,2017-12-08T13:59:58Z,,0,0,,0,,
secAES-ATmega8515,ANSSI-FR,GitHub,https://github.com/ANSSI-FR/secAES-ATmega8515,Secure AES128 Encryption Implementation for ATmega8515,False,2018-01-05T10:39:53Z,2019-04-22T13:40:03Z,,12,8,,0,Assembly,
bits_parser,ANSSI-FR,GitHub,https://github.com/ANSSI-FR/bits_parser,Extract BITS jobs from QMGR queue and store them as CSV records,False,2018-01-17T13:47:46Z,2019-05-07T05:26:32Z,,37,4,MIT License,0,Python,"forensics,incident-response,windows"
ASCAD,ANSSI-FR,GitHub,https://github.com/ANSSI-FR/ASCAD,Side Channels Analysis and Deep Learning,False,2018-01-19T10:04:55Z,2019-05-13T02:54:32Z,,34,11,,3,Python,
transdep,ANSSI-FR,GitHub,https://github.com/ANSSI-FR/transdep,Discover SPOF in DNS dependency graphs,False,2018-01-24T11:52:48Z,2019-05-14T12:17:09Z,,11,2,"BSD 2-Clause ""Simplified"" License",1,Go,
FreeSpec,ANSSI-FR,GitHub,https://github.com/ANSSI-FR/FreeSpec,Compositional reasoning framework for the Coq proof assistant,False,2018-01-26T16:34:46Z,2019-05-25T08:20:17Z,https://anssi-fr.github.io/FreeSpec,29,5,GNU General Public License v3.0,12,Coq,
libapn,ANSSI-FR,GitHub,https://github.com/ANSSI-FR/libapn,"libapn is a header-based C++ library developed to study vectorial Boolean functions, including but not limited to APN functions.",False,2018-04-18T14:27:38Z,2019-05-19T10:11:16Z,,3,2,GNU General Public License v3.0,0,C++,
parsifal,ANSSI-FR,GitHub,https://github.com/ANSSI-FR/parsifal,Parsifal : an OCaml-based parsing engine,False,2018-08-27T12:34:56Z,2018-08-27T12:40:25Z,,0,0,,0,,
concerto,ANSSI-FR,GitHub,https://github.com/ANSSI-FR/concerto,Toolset to analyse TLS datasets,False,2018-08-27T12:41:32Z,2019-05-14T12:15:33Z,,1,0,,0,,
pycrate,ANSSI-FR,GitHub,https://github.com/ANSSI-FR/pycrate,A Python library to ease the development of encoders and decoders for various protocols and file formats; contains ASN.1 and CSN.1 compilers. ,False,2018-09-17T08:11:37Z,2019-05-25T14:52:58Z,,3,1,,0,,
caradoc,ANSSI-FR,GitHub,https://github.com/ANSSI-FR/caradoc,A PDF parser and validator,False,2018-09-21T07:32:59Z,2019-05-20T16:18:34Z,,5,1,,0,,
coq-prelude,ANSSI-FR,GitHub,https://github.com/ANSSI-FR/coq-prelude,General-purpose monad typeclass hierarchy for Coq,False,2018-09-21T15:00:07Z,2019-05-21T10:48:35Z,,1,0,GNU General Public License v3.0,1,Coq,
audit-radius,ANSSI-FR,GitHub,https://github.com/ANSSI-FR/audit-radius,A RADIUS authentication server audit tool,False,2018-10-15T14:40:52Z,2019-05-02T13:16:30Z,,56,15,,0,Python,
rust-guide,ANSSI-FR,GitHub,https://github.com/ANSSI-FR/rust-guide,Recommendations for secure applications development with Rust,False,2018-12-05T19:50:13Z,2019-05-24T12:24:10Z,https://anssi-fr.github.io/rust-guide,268,13,Other,4,,"good-practices,recommendations,rust,secure-coding"
ORADAD,ANSSI-FR,GitHub,https://github.com/ANSSI-FR/ORADAD,Outil de récupération automatique des données de l'Active Directory / Automated tool for dumping Active Directory data,False,2018-12-18T13:27:49Z,2019-05-21T19:58:27Z,,66,9,GNU General Public License v3.0,0,C,
ADTimeline,ANSSI-FR,GitHub,https://github.com/ANSSI-FR/ADTimeline,PowerShell script creating a timeline of Active Directory changes with replication metadata,False,2019-01-08T15:11:36Z,2019-05-23T20:05:23Z,,102,12,GNU General Public License v3.0,0,PowerShell,"active-directory,dfir,forensics,powershell,timeline,windows"
mdbook-checklist,ANSSI-FR,GitHub,https://github.com/ANSSI-FR/mdbook-checklist,mdbook preprocessor for generating checklists and indexes,False,2019-02-15T08:40:23Z,2019-04-30T07:50:07Z,,0,0,Other,0,Rust,
cornetto,ANSSI-FR,GitHub,https://github.com/ANSSI-FR/cornetto,Outil de gestion de version statique de site web,False,2019-05-06T09:38:29Z,2019-05-06T09:38:29Z,,0,0,,0,,
SecAESSTM32,ANSSI-FR,GitHub,https://github.com/ANSSI-FR/SecAESSTM32,Bibliothèque C et assembleur permettant le chiffrement/déchiffrement AES-128 de messages pour des composants grand public (famille STM32F3/STM32F4),False,2019-05-06T09:47:13Z,2019-05-25T06:37:57Z,,25,4,Other,0,C,
