nom,organisation_nom,plateforme,repertoire_url,description,est_fork,date_creation,derniere_mise_a_jour,page_accueil,nombre_stars,nombre_forks,licence,nombre_issues_ouvertes,langage,topics,software_heritage_exists,software_heritage_url
WindowsAgent,OCSInventory-NG,GitHub,https://github.com/OCSInventory-NG/WindowsAgent, OCS Inventory NG Agent for Windows,False,2015-06-01T13:10:03Z,2019-08-01T06:27:01Z,http://www.ocsinventory-ng.org/en/,74,47,Other,33,C++,"agent,deployment,inventory,ocs,ocs-deployment,ocs-inventory,windows",True,https://archive.softwareheritage.org/browse/origin/https://github.com/OCSInventory-NG/WindowsAgent/directory/
OCSInventory-Server,OCSInventory-NG,GitHub,https://github.com/OCSInventory-NG/OCSInventory-Server, Communication server of OCS Inventory,False,2015-06-01T16:09:52Z,2019-07-30T02:37:21Z,http://www.ocsinventory-ng.org/en/,152,74,GNU General Public License v2.0,31,Perl,"assets,assets-management,inventory,ocs,ocs-deployment,ocs-inventory,perl,server",True,https://archive.softwareheritage.org/browse/origin/https://github.com/OCSInventory-NG/OCSInventory-Server/directory/
AndroidAgent,OCSInventory-NG,GitHub,https://github.com/OCSInventory-NG/AndroidAgent,OCS Inventory NG Android Agent,False,2015-06-02T07:32:45Z,2019-06-17T14:55:30Z,http://www.ocsinventory-ng.org/en/,16,17,GNU General Public License v2.0,3,Java,"agent,android,deployment,inventory,ocs,ocs-deployment",True,https://archive.softwareheritage.org/browse/origin/https://github.com/OCSInventory-NG/AndroidAgent/directory/
OCSInventory-ocsreports,OCSInventory-NG,GitHub,https://github.com/OCSInventory-NG/OCSInventory-ocsreports,Webconsole for OCS Inventory NG,False,2015-06-02T09:28:21Z,2019-07-22T07:45:13Z,http://www.ocsinventory-ng.org/en/,111,92,GNU General Public License v2.0,71,PHP,"assets,assets-management,deployment,inventory,ocs,ocs-deployment,ocs-inventory,open-source,web-interface",True,https://archive.softwareheritage.org/browse/origin/https://github.com/OCSInventory-NG/OCSInventory-ocsreports/directory/
Macosx-Packager,OCSInventory-NG,GitHub,https://github.com/OCSInventory-NG/Macosx-Packager,It creates custom installation package to be able to deploy OCS Inventory NG MacOSX silently using Apple Remote Desktop or scripts,False,2015-06-02T10:19:39Z,2019-01-07T09:23:09Z,,4,5,GNU General Public License v2.0,1,Objective-C,,True,https://archive.softwareheritage.org/browse/origin/https://github.com/OCSInventory-NG/Macosx-Packager/directory/
Agent-Deployment-Tool,OCSInventory-NG,GitHub,https://github.com/OCSInventory-NG/Agent-Deployment-Tool,Allows you to remote setup OCS Inventory NG agent on Windows and Unix/Linux/BSD computers,False,2015-06-02T10:23:45Z,2019-07-13T12:54:44Z,,4,7,GNU General Public License v3.0,2,C++,,True,https://archive.softwareheritage.org/browse/origin/https://github.com/OCSInventory-NG/Agent-Deployment-Tool/directory/
Packager-for-Windows,OCSInventory-NG,GitHub,https://github.com/OCSInventory-NG/Packager-for-Windows,"The packager helps installing OCS Inventory NG Agent for Windows (or any windows application). It create an executable package including multiple files to install, and is able to run the installation process under the specified account having Administrative privileges.",False,2015-06-02T12:20:13Z,2019-07-13T12:54:48Z,,7,4,Other,5,NSIS,,True,https://archive.softwareheritage.org/browse/origin/https://github.com/OCSInventory-NG/Packager-for-Windows/directory/
UnixAgent,OCSInventory-NG,GitHub,https://github.com/OCSInventory-NG/UnixAgent,This is the OCS unified agent for Unix operating systems,False,2015-06-02T13:29:00Z,2019-08-01T09:35:17Z,http://www.ocsinventory-ng.org/en/,45,54,GNU General Public License v2.0,9,Perl,"agent,deployment,ocs,ocs-deployment,ocs-inventory,ocsinventory,unix",True,https://archive.softwareheritage.org/browse/origin/https://github.com/OCSInventory-NG/UnixAgent/directory/
Ansible-Role-For-UnixAgent,OCSInventory-NG,GitHub,https://github.com/OCSInventory-NG/Ansible-Role-For-UnixAgent,An Ansible role for installing ocsinventory-agent | Thx to @franlr for his amazing contribution !,True,2016-04-21T09:45:28Z,2016-11-17T11:32:41Z,,1,2,Apache License 2.0,0,,,True,https://archive.softwareheritage.org/browse/origin/https://github.com/OCSInventory-NG/Ansible-Role-For-UnixAgent/directory/
Wiki,OCSInventory-NG,GitHub,https://github.com/OCSInventory-NG/Wiki,Official repository for OCS Inventory documentaiton,False,2016-04-27T14:20:32Z,2019-06-19T08:24:16Z,https://wiki.ocsinventory-ng.org,14,17,GNU General Public License v2.0,6,,"documentation,installation,ocs-inventory,ocsinventory,wiki",True,https://archive.softwareheritage.org/browse/origin/https://github.com/OCSInventory-NG/Wiki/directory/
OCSInventory-Docker-Stack,OCSInventory-NG,GitHub,https://github.com/OCSInventory-NG/OCSInventory-Docker-Stack,Docker stack for OCSInventory Server,False,2016-12-15T10:51:19Z,2019-07-17T08:16:35Z,,29,24,GNU General Public License v3.0,2,Shell,"assets,assets-management,docker-container,ocs,ocs-inventory,open-source,stack",False,
OCSInventory-Docker-Image,OCSInventory-NG,GitHub,https://github.com/OCSInventory-NG/OCSInventory-Docker-Image,Docker image for OCSInventory Server,False,2017-02-15T15:10:37Z,2019-07-29T09:16:30Z,,23,33,GNU General Public License v3.0,7,Shell,"assets,assets-management,docker-image,inventory,ocs,ocs-inventory,open-source",True,https://archive.softwareheritage.org/browse/origin/https://github.com/OCSInventory-NG/OCSInventory-Docker-Image/directory/
packages,OCSInventory-NG,GitHub,https://github.com/OCSInventory-NG/packages,Where we put files used to create packages,False,2017-06-11T13:54:31Z,2018-04-16T12:17:26Z,,0,1,,0,Shell,,True,https://archive.softwareheritage.org/browse/origin/https://github.com/OCSInventory-NG/packages/directory/
Packager-for-Unix,OCSInventory-NG,GitHub,https://github.com/OCSInventory-NG/Packager-for-Unix,This packager create a standalone executable for linux with configuration setup. The created packager doesn't require any modification or dependencies installation on the system which can be helpful depending on business security policy.,False,2017-11-10T15:51:15Z,2018-08-04T14:23:48Z,,1,3,GNU General Public License v3.0,2,Shell,,True,https://archive.softwareheritage.org/browse/origin/https://github.com/OCSInventory-NG/Packager-for-Unix/directory/
Ansible-Role-For-Unix-Packager,OCSInventory-NG,GitHub,https://github.com/OCSInventory-NG/Ansible-Role-For-Unix-Packager,An ansible role to deploy and run remotely the archive generated by Packager from Unix available here https://github.com/OCSInventory-NG/Packager-for-Unix,False,2017-11-23T08:17:13Z,2017-11-23T09:25:30Z,https://github.com/OCSInventory-NG/Packager-for-Unix,0,1,GNU General Public License v3.0,0,,,True,https://archive.softwareheritage.org/browse/origin/https://github.com/OCSInventory-NG/Ansible-Role-For-Unix-Packager/directory/
